StartDate,EndDate,Status,Progress,Duration (in seconds),Finished,RecordedDate,DistributionChannel,UserLanguage,Q1.2,Q1.3_Browser,Q1.3_Version,Q1.3_Operating System,Q1.3_Resolution,Q2.2_1,Q2.2_2,Q2.2_3,Q2.2_4,Q2.2_5,Q2.2_6,Q2.3_1,Q2.3_2,Q2.3_3,Q3.2_1,Q3.2_2,Q3.2_3,Q3.2_4,Q3.2_5,Q3.2_6,Q3.3_1,Q3.3_2,Q3.3_3,Q5.3,Q5.4,Q5.5,Q5.6,Q6.2_1,Q6.2_2,Q6.2_3,Q6.2_4,Q7.2,Q7.3,Q8.3_First Click,Q8.3_Last Click,Q8.3_Page Submit,Q8.3_Click Count,Q8.5_First Click,Q8.5_Last Click,Q8.5_Page Submit,Q8.5_Click Count,Q8.6,Q8.7,Q10.3_First Click,Q10.3_Last Click,Q10.3_Page Submit,Q10.3_Click Count,Q10.5_First Click,Q10.5_Last Click,Q10.5_Page Submit,Q10.5_Click Count,Q10.6,Q10.7,Q14.2_First Click,Q14.2_Last Click,Q14.2_Page Submit,Q14.2_Click Count,Q15.2,Q15.3,Q15.4,Q15.5,Q15.6,Q15.7,Q160,Q16.2,Q16.3,Q16.7_1,Q16.7_2,Q16.7_3,Q16.8_1,Q16.8_1_TEXT,Q298,Q17.1,Q17.1_7_TEXT,Q6.3_1,Q6.3_2,Q6.4,Q5.8,Q5.9,Q5.10,Q16.5,Q16.6,Q18.2,Q18.3,Q4.2,Q4.3,Q4.4,Q20.2,Q20.3,Q20.4,Q20.5,Q18.4,Q18.5,Q19.2_8,Q19.3,Q19.4,Q19.4_9_TEXT,Q19.5,Q19.6,Q19.7,Q19.7_2_TEXT,Q19.8,Q19.9,Q19.9_2_TEXT,Q19.10,Q20.6
1/28/2021 6:41,1/28/2021 6:45,0,100,252,1,1/28/2021 6:45,anonymous,EN-GB,1,Chrome,80.0.3987.119,Android 9.0,1024x600,7,7,7,7,7,,7,7,7,,,,,,,,,,7,7,7,7,,,,,7,7,36.832,36.832,38.285,1,4.139,4.139,5.493,1,7,7,,,,,,,,,,,1.556,1.949,3.264,2,7,7,7,7,7,7,,4,dfgffdf,3,3,3,4,liioh,1,6,,,,,,,,,,,,,,,,,,,,,,,,,,,,,,,,,
1/28/2021 6:43,1/28/2021 6:48,0,100,332,1,1/28/2021 6:48,anonymous,EN-GB,1,Chrome,88.0.4324.93,Android 10,412x915,6,7,6,7,5,,7,7,7,,,,,,,,,,5,7,7,4,,,,,5,4,,,,,,,,,,,0,0,28.991,0,10.21,15.2,17.946,2,7,6,17.193,17.193,18.682,1,7,5,6,7,7,7,,4,"I firmly believe in the efficiency and safety of vaccines. If it has been tested safe until now, I see no reason to not receive it.",4,4,4,,,2,7,99,,,,6,6,6,1,2,1,1,2,4,7,4,4,,1,2,,33,2,5,,2,9,1,,31,1,,2,
1/28/2021 6:43,1/28/2021 6:49,0,100,335,1,1/28/2021 6:49,anonymous,EN-GB,1,Safari iPhone,14.0.2,iPhone,375x667,4,4,3,6,1,,3,3,5,,,,,,,,,,3,2,1,1,,,,,4,5,,,,,,,,,,,0.629,7.216,10.723,3,0.708,0.708,4,1,7,7,4.631,5.099,6.434,2,5,6,6,4,4,4,,3,I have a nut allergy and carry an epipen ,3,3,3,,,2,7,99,,,,7,7,1,2,2,1,1,4,4,4,4,4,,2,2,,23,2,7,,2,3,1,,21,1,,1,
1/28/2021 6:42,1/28/2021 6:49,0,100,407,1,1/28/2021 6:49,anonymous,EN-GB,1,Safari iPhone,14.0.3,iPhone,375x812,5,5,5,6,5,,5,6,6,,,,,,,,,,6,5,1,4,,,,,6,6,2.515,5.608,22.739,2,3.331,6.052,16.381,2,7,5,,,,,,,,,,,7.896,25.864,35.509,7,7,2,3,7,7,5,,3,"I believe it may better , because its been tested for a long time and its re maked for better quality",3,3,4,,,2,7,99,,,,6,7,5,1,2,3,1,3,7,1,4,7,,1,2,,25,2,8,,2,8,1,,7,1,,2,
1/28/2021 6:42,1/28/2021 6:49,0,100,399,1,1/28/2021 6:49,anonymous,EN-GB,1,Chrome,87.0.4280.141,Android 9,360x780,4,4,4,7,6,,4,4,7,,,,,,,,,,2,4,3,3,,,,,5,4,,,,,,,,,,,4.794,17.785,29.624,5,1.916,18.002,19.705,3,7,5,1.398,25.259,26.232,9,4,3,4,4,4,4,,1,I would like to wait to see long term affects ,3,3,3,,,2,7,99,,,,5,4,4,1,2,1,1,4,4,4,5,4,,1,1,Surveys ,22,2,3,,2,2,1,,26,1,,1,No
1/28/2021 6:41,1/28/2021 6:49,0,100,471,1,1/28/2021 6:49,anonymous,EN-GB,1,Chrome,88.0.4324.104,Windows NT 10.0,1920x1080,,,,,,,,,,4,5,5,5,2,,5,5,6,,,,,3,5,1,4,4,3,0,0,41.59,0,8.733,8.733,9.343,1,6,4,,,,,,,,,,,0,0,58.531,0,6,5,5,5,4,6,,4,I am a health care worker . i would take the vaccine as safeguarding for the vulnerable people i work with,3,4,3,,,2,7,99,7,7,4,,,,1,1,1,2,4,5,2,5,6,,1,2,,29,2,7,,1,4,1,,30,1,,1,
1/28/2021 6:42,1/28/2021 6:50,0,100,455,1,1/28/2021 6:50,anonymous,EN-GB,1,Firefox,85,Macintosh,1792x1120,,,,,,,,,,6,6,6,6,6,,5,6,7,,,,,5,6,5,3,5,5,,,,,,,,,,,8.528,8.528,10.211,1,8.678,12.623,14.555,2,6,2,16.77,16.77,20.694,1,7,5,3,7,7,7,,4,I am going to put my faith in scientists,4,3,3,,,1,7,99,5,3,6,,,,2,2,2,3,2,6,5,2,3,The algorithm contains the biases of the person who programmed it.,1,2,,27,1,7,,2,3,1,,7,1,,3,
1/28/2021 6:41,1/28/2021 6:50,0,100,552,1,1/28/2021 6:50,anonymous,EN-GB,1,Edge,88.0.705.50,Windows NT 10.0,1280x720,,,,,,,,,,5,5,6,7,6,,5,4,5,,,,,5,7,5,3,4,3,0,0,51.148,0,0,0,21.274,0,7,5,,,,,,,,,,,0,0,27.779,0,4,6,5,4,4,6,,3,Even though I feel a little reluctant and nevous I think it's better to be vaccinated so as to bring covid under control,3,4,4,,,1,7,99,5,6,5,,,,2,1,4,2,5,5,4,5,4,,1,2,,47,2,6,,2,8,1,,9,1,,1,
1/28/2021 6:43,1/28/2021 6:50,0,100,428,1,1/28/2021 6:50,anonymous,EN-GB,1,Chrome,88.0.4324.104,Windows NT 10.0,1366x768,,,,,,,,,,4,4,4,4,2,,4,3,4,,,,,4,7,4,4,4,4,,,,,,,,,,,0,0,9.46,0,0,0,4.909,0,6,4,0,0,23.593,0,7,1,1,7,7,7,,4,its safe,3,3,3,,,1,7,99,4,4,3,,,,2,1,2,5,5,3,2,4,4,,,2,,35,1,8,,2,9,1,,19,1,,2,
1/28/2021 6:42,1/28/2021 6:52,0,100,579,1,1/28/2021 6:52,anonymous,EN-GB,1,Firefox,84,Windows NT 10.0,1366x768,,,,,,,,,,1,1,1,3,1,,1,1,1,,,,,1,1,1,1,1,1,,,,,,,,,,,0,0,44.588,0,18.395,18.395,19.348,1,5,7,0,0,26.443,0,1,7,7,1,1,5,,1,"Healthy people should not be vaccinated, also vaccinations have created several diseases. More people are dying from it. Also being forced to take vaccinations is very wrong. It would seem that it's all about money, power and control",1,1,1,,,2,7,99,1,1,1,,,,2,1,4,3,4,1,3,1,1,"it does not take into account of real life situations as every person and every family have different circumstances, hence would lead to incorrect judgements and result in suffering",1,2,,46,1,7,,2,4,1,,9,1,,1,
1/28/2021 6:41,1/28/2021 6:52,0,100,668,1,1/28/2021 6:52,anonymous,EN-GB,1,Chrome,85.0.4183.81,Android 9,360x780,5,5,5,6,5,,6,6,6,,,,,,,,,,3,7,1,2,,,,,4,4,,,,,,,,,,,3.928,24.149,33.671,3,9.335,12.684,18.451,3,7,4,12.62,63.455,65.927,8,6,4,4,6,5,5,,3,We have to put certain belief in our medical system and the country and eu union will not take any risk when it comes to the health of these many people,4,3,4,,,2,7,99,,,,6,5,6,2,2,4,2,4,4,5,5,4,,,2,,32,2,6,,2,8,1,,7,2,Malayalam,3,
1/28/2021 6:42,1/28/2021 6:53,0,100,663,1,1/28/2021 6:53,anonymous,EN-GB,1,Chrome,87.0.4280.88,Windows NT 6.1,1366x768,,,,,,,,,,4,5,5,5,4,,5,5,5,,,,,5,6,3,4,4,5,,,,,,,,,,,0,0,29.098,0,0,0,17.243,0,7,5,0,0,17.865,0,5,5,5,6,6,6,,4,i am in the high risk category as i have a lung condition and have confidence in the vaccine. I will feel more protected if I got it. I will certainly take it as soon as its available to me. I have confidence in it.,3,2,3,1,,3,7,99,7,6,6,,,,2,2,4,4,4,5,2,5,5,,1,2,,31,2,7,,2,7,1,,31,1,,1,"no. very interesting survey, thanks"
1/28/2021 6:43,1/28/2021 6:53,0,100,635,1,1/28/2021 6:53,anonymous,EN-GB,1,Chrome,87.0.4280.141,Windows NT 10.0,1600x900,,,,,,,,,,5,5,4,6,4,,5,7,6,,,,,3,6,5,2,3,2,,,,,,,,,,,0,0,20.418,0,0,0,22.572,0,6,3,0,0,28.707,0,6,3,2,6,6,6,,4,I am in a high risk category. If l get the virus it will be a death sentence. Assuming the vaccine works I will obviously take it.,4,2,4,,,2,7,99,7,2,6,,,,2,2,3,2,3,5,5,6,2,"One size does not fit all, and the algorithm system seems to produce an average.",1,2,,72,1,3,,2,3,1,,13,1,,3,Everything was as clear as it could be
1/28/2021 6:42,1/28/2021 6:55,0,100,792,1,1/28/2021 6:55,anonymous,EN-GB,1,Chrome,87.0.4280.152,CrOS x86_64 13505.111.0,1366x768,,,,,,,,,,4,3,3,5,4,,5,5,7,,,,,2,7,4,3,4,4,,,,,,,,,,,0,0,14.335,0,0,0,10.3,0,6,1,0,0,24.839,0,7,1,1,7,7,7,,4,I want to protect myself and my community from spreading covid,3,2,4,,,1,7,99,7,6,6,,,,2,2,2,6,6,1,1,7,3,impossible to argue against a decision which might be completely wrong,1,2,,46,1,4,,2,9,1,,12,1,,1,
1/28/2021 6:48,1/28/2021 6:55,0,100,425,1,1/28/2021 6:55,anonymous,EN-GB,1,Chrome,88.0.4324.93,Android 10,1280x800,4,4,4,6,2,,5,5,6,,,,,,,,,,4,7,2,5,,,,,4,4,,,,,,,,,,,1.136,1.136,6.718,1,1.754,1.754,9.001,1,7,6,3.822,4.364,4.844,2,6,6,5,6,5,5,,4,"I want to get on with  my life, the way we are living at the moment isn't life",4,4,3,,,1,7,99,,,,7,4,2,1,2,3,3,6,2,5,5,6,,,2,,46,1,4,,2,3,1,,5,1,,1,Interesting survey 
1/28/2021 6:41,1/28/2021 6:55,0,100,856,1,1/28/2021 6:55,anonymous,EN-GB,1,Chrome,88.0.4324.104,Windows NT 10.0,1920x1080,,,,,,,,,,6,6,6,6,5,,7,7,7,,,,,6,6,3,2,5,5,0,0,22.208,0,0,0,34.293,0,7,5,,,,,,,,,,,0,0,30.532,0,7,3,3,7,7,7,,4,I want to be vaccinated against Covid so I can continue my life as normal and not be subject to the lockdowns and strict life rules we are subject to.,4,4,4,,,1,7,99,7,2,7,,,,1,2,5,7,4,3,5,6,5,,1,2,,49,2,5,,2,9,1,,8,1,,1,
1/28/2021 6:42,1/28/2021 6:56,0,100,820,1,1/28/2021 6:56,anonymous,EN-GB,1,Firefox,84,Windows NT 6.1,1680x1050,,,,,,,,,,3,3,3,6,5,,3,4,4,,,,,4,5,4,2,5,4,0,0,71.239,0,0,0,68.831,0,6,3,,,,,,,,,,,0,0,53.077,0,6,3,6,6,6,6,,4,Preferable to dieing from covid!,4,2,4,,,1,7,99,7,4,5,,,,2,2,4,4,3,1,3,7,3,there can be errors,1,1,marking of state exams for purpose of predicted grades,44,1,7,,2,9,1,,26,1,,1,
1/28/2021 6:53,1/28/2021 6:56,0,100,210,1,1/28/2021 6:56,anonymous,EN-GB,1,Chrome,88.0.4324.104,Windows NT 10.0,1536x864,,,,,,,,,,5,5,4,4,4,,4,4,4,,,,,4,4,4,4,5,5,,,,,,,,,,,0,0,2.847,0,0,0,15.918,0,6,5,0,0,13.728,0,6,5,6,4,6,5,,3,noy sure,1,2,3,,,3,3,,,,,,,,,,,,,,,,,,,,,,,,,,,,,,,,,
1/28/2021 6:43,1/28/2021 6:57,0,100,870,1,1/28/2021 6:57,anonymous,EN-GB,1,Safari iPhone,14.0.2,iPhone,414x736,4,4,4,4,3,,4,4,4,,,,,,,,,,4,5,3,4,,,,,4,4,,,,,,,,,,,1.829,1.829,43.63,1,1.748,46.679,49.684,5,7,4,4.792,51.791,72.042,7,4,4,3,4,4,5,,3,Actually there’s no other options since you cannot travel without the vaccine since most airlines and other countries will probably look for your vaccine certificate ,4,4,4,,,2,7,99,,,,7,7,4,1,1,6,4,4,4,1,5,4,,1,2,,40,2,6,,1,2,1,,6,2,Filipino ,3,
1/28/2021 6:41,1/28/2021 6:57,0,100,964,1,1/28/2021 6:57,anonymous,EN-GB,1,Chrome,88.0.4324.104,Windows NT 10.0,1536x864,,,,,,,,,,7,7,6,7,3,,6,5,6,,,,,5,7,7,4,6,4,0,0,13.355,0,15.749,15.749,16.804,1,7,3,,,,,,,,,,,0,0,51.212,0,7,5,5,7,7,7,,4,I'm not an at risk person but I will be in contact with people who are so I'm happy to get the vaccine to protect loved ones. ,4,3,3,,,1,7,99,7,4,7,,,,1,2,7,3,4,4,3,4,4,,1,2,,32,2,8,,2,9,1,,7,1,,1,
1/28/2021 6:43,1/28/2021 6:58,0,100,881,1,1/28/2021 6:58,anonymous,EN-GB,1,Safari iPhone,13.1.2,iPhone,414x896,5,5,4,6,3,,4,4,6,,,,,,,,,,5,6,3,5,,,,,5,5,,,,,,,,,,,5.519,5.519,38.88,1,1.017,104.168,107.256,4,7,5,11.55,35.425,68.617,3,5,5,5,3,3,5,,3,"I do want to get a vaccine in theory, but I think this one was approved too soon and skipped some necessary trials ",3,3,4,,,2,7,99,,,,6,7,4,2,2,6,7,5,4,3,4,5,,,1,Not right away,29,2,8,,2,9,1,,7,2,Russian ,3,
1/28/2021 6:47,1/28/2021 6:58,0,100,640,1,1/28/2021 6:58,anonymous,EN-GB,1,Chrome,87.0.4280.88,Windows NT 6.3,1366x768,,,,,,,,,,2,2,2,2,1,,3,3,5,,,,,1,2,1,1,1,1,8.735,8.735,11.808,1,8.189,8.189,14.391,1,6,6,,,,,,,,,,,2.775,24.848,27.557,2,2,6,6,2,1,6,,1,"It's a genetically engineered vaccine and is new. In my view, not enough testing has been done and the long term effects are unknown",2,2,1,,,1,7,99,6,4,2,,,,2,2,2,4,5,1,4,4,2,it's bringing non-human decisions into issues that affect humans,1,2,,64,2,3,,2,6,1,,24,1,,2,no
1/28/2021 6:47,1/28/2021 6:58,0,100,687,1,1/28/2021 6:58,anonymous,EN-GB,1,Chrome,87.0.4280.141,Windows NT 10.0,1366x768,,,,,,,,,,4,4,4,7,2,,4,7,7,,,,,4,6,5,5,4,4,,,,,,,,,,,2.806,3.411,16.846,4,2.369,2.91,11.066,4,7,5,9.621,9.621,10.78,1,5,4,6,6,5,5,,3,I want to be protected against contracting covid 19 again. I was very ill first time round and dont want to go through that again. I would like lots more information on what is in the vaccine though just for some reasurrance. Its been made so quickly  that I just have a litlle doubt in my mind,4,4,4,,,2,7,99,7,7,6,,,,1,2,1,1,4,7,1,4,6,,,2,,44,2,3,,2,5,1,,31,1,,1,
1/28/2021 6:57,1/28/2021 6:59,0,100,79,1,1/28/2021 6:59,anonymous,EN-GB,1,Safari iPhone,Unknown,iPhone,414x736,3,3,4,5,4,,2,4,4,,,,,,,,,,3,4,3,4,,,,,4,3,,,,,,,,,,,0.356,0.74,1.385,2,0.376,0.827,1.401,2,4,5,0.379,0.848,1.508,2,4,3,2,5,4,5,,2,Alalajdic,3,2,2,,,3,4,,,,,,,,,,,,,,,,,,,,,,,,,,,,,,,,,
1/28/2021 6:50,1/28/2021 6:59,0,100,499,1,1/28/2021 6:59,anonymous,EN-GB,1,Chrome,88.0.4324.93,Android 10,320x676,7,7,7,7,7,,7,7,7,,,,,,,,,,7,7,7,7,,,,,7,7,1.005,12.066,13.98,15,0.791,12.409,13.356,11,7,7,,,,,,,,,,,4.011,17.718,18.652,12,7,7,7,7,7,7,,4,I have underlying problems and are at risk so would be great if I got it,4,4,4,,,3,7,99,,,,7,7,7,2,2,7,7,7,7,7,7,7,,2,2,,51,2,2,,2,2,1,,,2,Irish ,1,No
1/28/2021 6:47,1/28/2021 6:59,0,100,691,1,1/28/2021 6:59,anonymous,EN-GB,1,Chrome,87.0.4280.141,Android 10,412x915,7,4,3,2,1,,7,6,3,,,,,,,,,,4,7,7,1,,,,,4,3,,,,,,,,,,,20.614,20.614,27.701,1,1.37,29.267,30.108,5,7,7,2.471,74.183,85.728,4,7,7,7,7,7,7,,1,"Of it protects you, it would be silly not to avail of it. ",4,4,2,,,2,7,99,,,,7,7,4,1,1,7,7,1,4,1,4,5,,,2,,60,2,5,,2,7,1,,13,1,,2,
1/28/2021 6:44,1/28/2021 7:01,0,100,1047,1,1/28/2021 7:01,anonymous,EN-GB,1,Chrome,88.0.4324.93,Android 10,360x771,5,5,5,5,3,,5,5,5,,,,,,,,,,4,5,2,2,,,,,3,3,,,,,,,,,,,6.994,23.161,24.3,5,7.564,16.403,17.191,3,7,4,21.575,102.966,104.699,16,5,4,4,6,5,6,,1,Because it was the first one to be approved but will get the next one ,4,3,2,,,1,7,99,,,,6,1,3,2,1,5,6,1,1,2,2,2,Because it doesn't take into account human habits ,1,2,,55,1,5,,2,8,1,,4,1,,1,No 
1/28/2021 7:01,1/28/2021 7:02,0,100,83,1,1/28/2021 7:02,anonymous,EN-GB,1,Chrome,87.0.4280.141,Windows NT 10.0,1536x864,,,,,,,,,,7,6,6,7,6,,6,5,6,,,,,7,5,6,1,6,7,0,0,1.49,0,0,0,1.26,0,6,5,,,,,,,,,,,0,0,1.062,0,6,7,6,5,6,5,,3,good to use,4,3,3,,,1,2,,,,,,,,,,,,,,,,,,,,,,,,,,,,,,,,,
1/28/2021 6:51,1/28/2021 7:02,0,100,695,1,1/28/2021 7:02,anonymous,EN-GB,1,Chrome,88.0.4324.104,Windows NT 10.0,1366x768,,,,,,,,,,4,4,4,7,1,,3,5,5,,,,,3,6,1,1,1,1,,,,,,,,,,,0,0,25.493,0,0,0,35.713,0,7,4,0,0,48.26,0,5,2,2,5,3,5,,4,I will take any vaccine available to stop this virus,3,3,3,,,2,7,99,7,1,3,,,,2,2,4,4,2,1,2,1,1,they are taken as truth and there are not enough variables,1,1,"leaving certificate, causing major stress to students with wrong assessments",61,2,2,,2,4,1,,13,1,,1,
1/28/2021 6:53,1/28/2021 7:02,0,100,538,1,1/28/2021 7:02,anonymous,EN-GB,1,Chrome,88.0.4324.104,Windows NT 10.0,1366x768,,,,,,,,,,6,6,6,6,3,,7,7,7,,,,,6,6,3,4,4,4,0,0,28.831,0,0,0,25.987,0,6,5,,,,,,,,,,,0,0,55.169,0,6,4,4,6,6,6,,4,better to be safe then sorry,4,4,4,,,2,7,99,6,3,3,,,,2,2,4,4,4,4,5,4,4,,1,2,,46,2,4,,2,8,1,,8,1,,2,
1/28/2021 7:00,1/28/2021 7:03,0,100,166,1,1/28/2021 7:03,anonymous,EN-GB,1,Chrome,88.0.4324.93,Android 10,412x846,4,4,4,3,2,,4,3,3,,,,,,,,,,3,3,2,6,,,,,2,3,,,,,,,,,,,0.628,0.628,1.413,1,0.43,0.43,1.32,1,2,3,0.81,0.81,1.678,1,1,4,5,2,2,4,,2,Na,2,2,2,2,Na,3,3,,,,,,,,,,,,,,,,,,,,,,,,,,,,,,,,,
1/28/2021 6:50,1/28/2021 7:04,0,100,860,1,1/28/2021 7:04,anonymous,EN-GB,1,Chrome,88.0.4324.104,Windows NT 6.1,1920x1080,,,,,,,,,,3,3,3,5,2,,2,3,4,,,,,2,2,5,4,5,4,0,0,8.447,0,0,0,2.441,0,6,4,,,,,,,,,,,0,0,1.36,0,4,4,3,4,4,3,,2,just the speed of getting it worries me,2,2,2,,,2,7,99,6,3,3,,,,2,2,3,3,4,5,3,4,5,,1,2,,55,1,3,,2,3,1,,14,1,,3,
1/28/2021 6:57,1/28/2021 7:04,0,100,417,1,1/28/2021 7:04,anonymous,EN-GB,1,Chrome,88.0.4324.93,Android 10,360x760,4,4,4,4,1,,4,4,4,,,,,,,,,,2,4,2,4,,,,,3,3,,,,,,,,,,,3.599,6.348,7.788,2,1.41,1.41,2.733,1,7,4,1.35,1.35,2.659,1,4,2,2,4,4,4,,3,To get my life bact to normal ,4,4,4,,,2,7,99,,,,7,7,5,2,2,2,2,3,4,3,5,4,,,2,,63,1,4,,2,2,1,,5,1,,1,
1/28/2021 6:50,1/28/2021 7:07,0,100,1005,1,1/28/2021 7:07,anonymous,EN-GB,1,Chrome,88.0.4324.93,Android 9,360x760,4,4,4,5,2,,5,4,4,,,,,,,,,,3,5,2,4,,,,,4,3,14.357,41.744,42.729,2,3.5,4.684,6.023,2,6,5,,,,,,,,,,,17.673,20.423,26.902,2,5,4,5,6,4,6,,3,It's a better chance of survival,3,3,3,,,2,7,99,,,,5,3,5,2,2,3,5,2,2,2,2,4,,1,1,Step by step procedure,69,1,3,,2,3,1,,17,1,,1,No
1/28/2021 6:43,1/28/2021 7:09,0,100,1548,1,1/28/2021 7:09,anonymous,EN-GB,1,Chrome,88.0.4324.104,Windows NT 10.0,1920x1080,,,,,,,,,,1,1,1,2,1,,1,1,2,,,,,1,1,1,4,2,1,,,,,,,,,,,0,0,41.429,0,0,0,48.373,0,7,7,0,0,60.726,0,1,7,7,1,1,7,,1,Because I have zero trust in it. Plus zero trust in the governments world wide and so called medical experts who are trying to rush this vaccine true. It most certainly is not for the greater good of the people. Plus there is no need for this vaccine! ,1,1,1,,,3,7,99,1,3,1,,,,2,1,4,4,1,1,4,1,2,"Everything Government related is unfair, based on everything!",1,2,,69,2,4,,2,3,1,,28,1,,1,"Not today, thank you."
1/28/2021 7:04,1/28/2021 7:11,0,100,450,1,1/28/2021 7:11,anonymous,EN-GB,1,Chrome,88.0.4324.93,Android 10,360x800,5,5,5,5,5,,5,5,5,,,,,,,,,,6,6,6,4,,,,,5,5,0.608,0.608,1.6,1,0.531,0.531,1.36,1,5,5,,,,,,,,,,,4.564,4.564,5.593,1,6,5,5,5,6,6,,2,I don't need it,3,3,3,,,2,7,99,,,,5,6,5,1,2,2,2,3,5,2,4,4,,2,2,,18,1,3,,2,5,1,,6,2,Polish,3,Nah
1/28/2021 7:05,1/28/2021 7:14,0,100,550,1,1/28/2021 7:14,anonymous,EN-GB,1,Chrome,88.0.4324.104,Windows NT 10.0,1536x864,,,,,,,,,,7,7,7,7,1,,7,7,7,,,,,7,7,7,7,7,7,0,0,124.56,0,0,0,21.564,0,7,5,,,,,,,,,,,0,0,48.165,0,7,6,4,7,7,7,,2,there is insufficient time for it to be tested and i do not trust it will not make the problem worse. ,4,4,4,,,1,7,99,5,7,5,,,,1,2,1,1,3,5,1,5,6,,1,2,,19,2,3,,2,4,1,,27,1,,1,
1/28/2021 7:02,1/28/2021 7:17,0,100,900,1,1/28/2021 7:17,anonymous,EN-GB,1,Chrome,49.0.2623.112,Windows NT 6.0,1280x800,,,,,,,,,,1,1,1,6,1,,1,4,4,,,,,6,6,3,4,4,2,29.421,29.421,55.583,1,32.76,32.76,34.679,1,7,5,,,,,,,,,,,32.776,32.776,47.085,1,6,4,4,6,6,6,,4,"could protect me against the virus,seems the sensible thing to do and helps out the health service,1 less possible infected patient to care for",3,3,2,,,1,7,99,6,4,2,,,,2,2,2,4,4,3,6,6,4,,1,2,,56,1,3,,2,2,1,,19,1,,1,
1/28/2021 7:14,1/28/2021 7:23,0,100,579,1,1/28/2021 7:23,anonymous,EN-GB,1,Safari,14.0.2,Macintosh,768x1024,,,,,,,,,,4,4,4,6,4,,4,4,4,,,,,4,6,4,4,4,4,0,0,9.025,0,0,0,10.517,0,4,4,,,,,,,,,,,0,0,2.097,0,4,4,4,4,4,4,,3,I think it is important to be vaccinated.,3,3,3,,,2,7,99,5,4,5,,,,2,2,2,2,4,4,4,4,4,,2,2,,22,2,4,,2,6,1,,9,1,,3,
1/28/2021 7:06,1/28/2021 7:26,0,100,1183,1,1/28/2021 7:26,anonymous,EN-GB,1,Chrome,88.0.4324.104,Windows NT 10.0,1366x768,,,,,,,,,,7,7,7,7,5,,7,7,7,,,,,7,7,4,4,7,5,2.593,42.673,49.22,2,2.053,50.519,53.06,2,7,7,,,,,,,,,,,52.396,56.804,58.063,2,6,7,7,7,6,6,,4,"There are a number of vaccines being produced and I have no idea which one is the best or which one we will get first.   However, I will have to trust the Scientists and Doctors (my G.P.) to do what they think is right.   After all this is a very very serious virus and nobody knows what they are dealing with but the Scientists are doing all they can to get vaccines out there.   I will just have to trust that the one I get will be effective.  ",4,4,4,,,1,7,,7,7,7,,,,2,2,5,5,4,4,5,6,6,,1,1,They were userd in the calculation of grades in the Leaving Certificate in Ireland in 2020,74,2,3,,2,4,1,,28,1,,1,All fine
1/28/2021 6:43,1/28/2021 7:26,0,100,2578,1,1/28/2021 7:26,anonymous,EN-GB,1,Safari iPad,Unknown,iPad,768x1024,4,4,5,6,4,,5,6,6,,,,,,,,,,5,7,3,4,,,,,5,5,0,0,26.643,0,0,0,45.648,0,6,6,,,,,,,,,,,48.933,48.933,53.542,1,7,4,4,7,5,6,,4,Really there is no option if we want to get out of this pandemic it is the way forward I believe ,4,4,4,,,1,7,99,,,,7,5,5,2,2,4,5,4,6,5,5,5,,1,1,Used in making certain decisions ,57,2,4,,2,2,1,,4,1,,1,
1/28/2021 7:12,1/28/2021 7:26,0,100,871,1,1/28/2021 7:26,anonymous,EN-GB,1,Chrome,88.0.4324.93,Android 10,360x780,5,3,3,7,5,,5,3,6,,,,,,,,,,5,7,5,5,,,,,7,6,,,,,,,,,,,4.015,9.828,19.832,2,3.701,8.451,16.55,3,7,1,2.969,30.05,36.82,4,7,1,1,7,7,5,,4,I trust the information that I have read and seen through news reports.,4,2,4,,,1,7,99,,,,7,7,7,2,2,1,1,3,4,1,3,3,Sometimes the human aspect needs to be looked at  Algorithms can be good used as a guide not for total and final decision.,1,1,Was slightly aware but not fully,47,1,2,,2,5,1,,4,1,,3,
1/28/2021 8:05,1/28/2021 8:10,0,100,293,1,1/28/2021 8:10,anonymous,EN-GB,1,Chrome,87.0.4280.141,Windows NT 6.1,1024x768,,,,,,,,,,4,4,4,6,2,,5,4,4,,,,,5,7,4,5,2,2,,,,,,,,,,,2.378,11.198,15.692,14,0,0,9.854,0,4,4,0,0,2.34,0,5,4,4,4,4,4,,4,it's beneficial to society,3,3,3,3,,2,7,99,4,5,4,,,,1,2,4,4,4,4,5,3,4,,2,2,,21,1,4,,2,3,1,,4,1,,1,
1/28/2021 8:08,1/28/2021 8:10,0,100,129,1,1/28/2021 8:10,anonymous,EN-GB,1,Safari,14.0.2,Macintosh,2560x1440,,,,,,,,,,6,6,6,7,5,,6,5,6,,,,,6,7,6,4,5,4,,,,,,,,,,,0,0,13.665,0,0,0,6.729,0,7,6,0,0,9.007,0,6,6,5,6,6,7,,4,have to try something ! ,3,3,3,,,2,4,,,,,,,,,,,,,,,,,,,,,,,,,,,,,,,,,
1/28/2021 8:07,1/28/2021 8:11,0,100,283,1,1/28/2021 8:11,anonymous,EN-GB,1,Edge,88.0.705.50,Windows NT 6.3,1366x768,,,,,,,,,,7,7,7,7,6,,7,4,6,,,,,6,5,3,3,4,4,1.655,1.655,2.7,1,2.143,2.143,4.943,1,4,4,,,,,,,,,,,2.179,26.571,31.178,3,7,5,7,7,7,7,,3,was to fast making the vaccine and I'm still have my doubt about it,3,3,3,,,2,4,,,,,,,,,,,,,,,,,,,,,,,,,,,,,,,,,
1/28/2021 8:07,1/28/2021 8:13,0,100,370,1,1/28/2021 8:13,anonymous,EN-GB,1,Chrome,83.0.4103.106,Android 10,412x915,5,4,5,5,3,,4,4,5,,,,,,,,,,3,6,4,4,,,,,4,4,0,0,14.392,0,11.723,11.723,22.321,1,6,4,,,,,,,,,,,23.211,24.151,29.689,2,4,4,4,5,4,5,,4,Dont want to be in lockdown forever ,3,3,2,,,2,7,99,,,,7,5,4,2,2,3,3,4,4,1,4,5,,1,2,,27,2,6,,2,2,1,,6,1,,1,
1/28/2021 8:12,1/28/2021 8:15,0,100,169,1,1/28/2021 8:15,anonymous,EN-GB,1,Chrome,87.0.4280.141,Windows NT 10.0,1366x768,,,,,,,,,,6,5,6,4,4,,5,5,5,,,,,5,5,5,5,5,5,0,0,12.691,0,0,0,2.343,0,5,6,,,,,,,,,,,0,0,2.101,0,5,6,5,5,6,5,,3,they always have solution the vruis ,3,3,3,,,2,4,,,,,,,,,,,,,,,,,,,,,,,,,,,,,,,,,
1/28/2021 8:12,1/28/2021 8:15,0,100,200,1,1/28/2021 8:15,anonymous,EN-GB,1,Edge,88.0.705.53,Windows NT 10.0,1920x1080,,,,,,,,,,5,6,6,5,6,,5,6,7,,,,,5,6,7,6,5,5,,,,,,,,,,,0,0,21.11,0,0,0,21.05,0,5,6,0,0,1.545,0,6,3,4,3,6,6,,3,i thrust them,3,3,2,3,,3,4,,,,,,,,,,,,,,,,,,,,,,,,,,,,,,,,,
1/28/2021 8:10,1/28/2021 8:17,0,100,412,1,1/28/2021 8:17,anonymous,EN-GB,1,Chrome,88.0.4324.104,Windows NT 10.0,1366x768,,,,,,,,,,3,3,3,5,3,,4,4,5,,,,,5,7,5,7,6,5,,,,,,,,,,,0,0,16.255,0,0,0,14.543,0,6,5,0,0,17.33,0,6,6,5,5,5,6,,4,I have high degree of confidence in safety of vaccine and want to take to get back to normal life,3,3,3,,,2,7,99,5,4,3,,,,2,2,5,7,5,3,5,6,5,,2,1,Taxation authorities to check behaviours indicating underpayment or evasion of taxes,45,1,8,,2,8,1,,23,1,,1,
1/28/2021 8:09,1/28/2021 8:17,0,100,494,1,1/28/2021 8:17,anonymous,EN-GB,1,Edge,88.0.705.53,Windows NT 10.0,1366x768,,,,,,,,,,5,5,5,4,6,,5,4,6,,,,,6,6,1,4,4,3,2.465,2.465,3.783,1,2.433,2.433,3.616,1,7,6,,,,,,,,,,,17.181,17.181,18.489,1,6,3,3,7,6,6,,3,because of my age profile i might take it if the data on safety still holds up in say 6 months time,3,3,3,,,1,7,99,7,7,6,,,,2,2,5,6,4,5,6,5,3,the human involvement is the best way to make a decision,1,2,,65,1,3,,2,5,1,,16,1,,1,thank u
1/28/2021 8:06,1/28/2021 8:17,0,100,661,1,1/28/2021 8:17,anonymous,EN-GB,1,Safari iPhone,14.0.2,iPhone,375x667,6,6,6,7,5,,6,6,7,,,,,,,,,,4,5,1,4,,,,,5,4,27.314,27.314,30.243,1,15.227,36.395,43.114,2,7,4,,,,,,,,,,,6.438,59.475,60.832,3,5,3,4,5,5,5,,3,I hope I can protect vulnerable members of my family if I get vaccine ,3,3,4,,,1,7,99,,,,6,5,6,2,2,6,6,4,7,4,5,4,,,2,,26,2,4,,2,3,1,,25,2,Czech ,3,
1/28/2021 8:07,1/28/2021 8:18,0,100,660,1,1/28/2021 8:18,anonymous,EN-GB,1,Firefox,84,Windows NT 10.0,1366x768,,,,,,,,,,7,7,7,7,6,,3,4,7,,,,,4,7,7,4,4,5,,,,,,,,,,,18.616,19.894,21.644,2,13.826,19.961,21.749,2,7,7,27.168,27.168,37.467,1,7,6,6,7,7,7,,4,to keep us all safe,4,2,4,,,2,7,99,7,3,7,,,,2,2,6,6,7,6,7,5,5,,1,2,,66,1,4,,2,3,1,,31,1,,1,no thanks
1/28/2021 8:10,1/28/2021 8:19,0,100,511,1,1/28/2021 8:19,anonymous,EN-GB,1,Chrome,88.0.4324.93,Android 10,360x780,4,1,5,7,1,,4,7,4,,,,,,,,,,3,7,3,4,,,,,5,4,2.986,2.986,5.301,1,1.2,2.168,3.864,2,5,7,,,,,,,,,,,1.804,6.636,7.619,4,7,7,7,3,3,5,,4,I work with children and live with my family at home including my elderly grandparents so I would protect them too,4,3,2,,,2,7,99,,,,7,4,7,1,2,7,4,4,1,3,5,3,It isnt based on everyone ,1,2,,25,2,6,,2,2,1,,,1,,2,Thank you. 
1/28/2021 8:08,1/28/2021 8:20,0,100,692,1,1/28/2021 8:20,anonymous,EN-GB,1,Edge,88.0.705.50,Windows NT 10.0,1920x1080,,,,,,,,,,6,6,6,7,4,,6,7,7,,,,,5,7,1,4,6,4,0,0,31.427,0,0,0,35.677,0,7,1,,,,,,,,,,,0,0,41.991,0,7,2,2,7,7,7,,4,I believe in the vacicne and the science behind it. ,4,4,4,,,1,7,99,7,7,6,,,,2,2,4,6,1,7,4,7,5,,1,2,,46,1,4,,2,4,1,,5,1,,1,It was an interesting survey and I learnt more by doing it. an enjoyable survey.
1/28/2021 8:08,1/28/2021 8:21,0,100,793,1,1/28/2021 8:21,anonymous,EN-GB,1,Safari,14.0.2,Macintosh,768x1024,,,,,,,,,,6,6,6,6,5,,5,6,6,,,,,4,4,4,5,4,4,0,0,30.447,0,0,0,38.796,0,6,6,,,,,,,,,,,0,0,109.368,0,5,4,6,6,6,6,,4,Available in Ireland at present ,4,3,4,3,,2,7,99,7,6,4,,,,2,2,2,2,4,4,4,3,3,Biased,2,2,,45,2,8,,2,2,1,,17,1,,1,No
1/28/2021 8:05,1/28/2021 8:22,0,100,997,1,1/28/2021 8:22,anonymous,EN-GB,1,Chrome,83.0.4103.106,Android 9,360x740,5,5,5,5,3,,5,5,5,,,,,,,,,,5,7,4,4,,,,,5,4,1.154,32.245,37.299,6,1.195,35.952,56.049,16,7,5,,,,,,,,,,,1.086,48.799,59.214,20,5,4,4,5,5,6,,2,For me I would like to wait and see if there is any major side effects ,4,3,3,,,2,7,99,,,,7,7,4,2,2,1,1,4,4,2,3,4,,2,1,No,39,2,2,,2,5,1,,21,1,,1,
1/28/2021 8:14,1/28/2021 8:23,0,100,524,1,1/28/2021 8:23,anonymous,EN-GB,1,Chrome,88.0.4324.104,Windows NT 10.0,1366x768,,,,,,,,,,5,5,4,6,4,,5,6,6,,,,,4,7,6,3,6,4,,,,,,,,,,,0,0,22.193,0,0,0,21.136,0,7,5,0,0,30.571,0,7,1,1,7,7,7,,4,I believe that taking this vaccine is the first step in getting our lives back to some type of normality.,4,1,4,1,,2,7,99,7,2,5,,,,2,2,5,7,5,6,1,5,6,,1,2,,60,2,4,,2,6,1,,30,2,irish,1,just to say I thought it was a very interesting survey
