1/28/2021 10:07,1/28/2021 10:14,0,100,449,1,1/28/2021 10:14,anonymous,EN-GB,1,Safari,14.0.2,Macintosh,768x1024,,,,,,,,,,4,3,2,6,4,,5,7,7,,,,,5,7,3,3,4,3,,,,,,,,,,,0,0,12.356,0,0.624,18.028,19.122,3,7,3,0.808,8.171,9.842,2,5,4,3,7,5,4,,3,I believe it is safe and vital to get vaccinated for the public good and my own general health.,3,3,3,1,,2,7,99,6,7,5,,,,2,2,3,4,4,2,3,3,4,,1,1,"A smart city is an urban area, where collected surveillance data is used to improve various operations in this area. ",34,1,7,,2,7,1,,7,1,,1,
1/28/2021 10:12,1/28/2021 10:17,0,100,263,1,1/28/2021 10:17,anonymous,EN-GB,1,Safari iPhone,14.0.2,iPhone,414x896,7,6,6,7,5,,6,6,6,,,,,,,,,,7,7,4,5,,,,,7,7,,,,,,,,,,,0,0,0.824,0,0.665,0.665,2.311,1,7,7,0.306,0.808,2.08,2,7,7,7,7,7,7,,4,I do not have any problems in taking the vaccine and I think it’s a good way to stop the virus and things come back to normal,4,4,4,,,2,7,99,,,,7,7,6,1,1,7,7,4,4,4,7,7,,2,2,,26,2,5,,2,3,1,,17,2,Portuguese,3,No
1/28/2021 10:10,1/28/2021 10:18,0,100,473,1,1/28/2021 10:18,anonymous,EN-GB,1,Chrome,87.0.4280.141,Windows NT 10.0,1366x768,,,,,,,,,,6,7,6,7,6,,7,7,7,,,,,7,7,4,5,6,6,,,,,,,,,,,0,0,3.212,0,0,0,4.673,0,7,5,0,0,20.301,0,7,3,3,7,7,7,,4,i really trust pfizer,4,4,4,,,2,7,99,7,7,7,,,,2,2,7,7,5,5,5,4,4,,1,2,,38,2,6,,2,9,1,,5,2,filipino,3,none
1/28/2021 10:08,1/28/2021 10:18,0,100,584,1,1/28/2021 10:18,anonymous,EN-GB,1,Chrome,88.0.4324.104,Windows NT 10.0,1280x720,,,,,,,,,,5,3,4,4,4,,1,3,5,,,,,4,3,2,2,4,4,4.87,4.87,5.849,1,5.864,5.864,10.936,1,7,4,,,,,,,,,,,60.554,60.554,62.277,1,3,6,5,3,3,6,,2,Pfizer are exempt of any future problems or being taken to court they have nothing to loose if things go wrong,3,4,3,,,2,7,99,7,7,6,,,,2,2,3,3,4,4,5,6,4,,1,1,price surging,54,2,5,,2,9,1,,6,1,,2,
1/28/2021 10:07,1/28/2021 10:18,0,100,633,1,1/28/2021 10:18,anonymous,EN-GB,1,Safari,12.1.2,Macintosh,1440x900,,,,,,,,,,7,7,7,7,7,,7,7,7,,,,,4,7,3,3,7,7,,,,,,,,,,,0,0,25.224,0,0,0,33.334,0,7,2,0,0,55.174,0,7,2,2,7,7,7,,4,have received the first dose of the vaccine as I work in health service,4,2,4,,,1,7,99,7,4,7,,,,2,2,7,7,4,6,5,3,6,,2,2,,61,2,3,,1,6,1,,26,1,,1,
1/28/2021 10:09,1/28/2021 10:18,0,100,549,1,1/28/2021 10:18,anonymous,EN-GB,1,Chrome,88.0.4324.104,Windows NT 10.0,1536x864,,,,,,,,,,6,7,6,5,7,,6,5,7,,,,,7,6,7,5,6,7,,,,,,,,,,,0.469,2.229,2.842,3,0.554,1.386,2.213,2,6,7,2.78,4.312,4.742,4,6,6,7,6,5,7,,4,yes ofcours,4,3,4,,,1,7,99,5,7,6,,,,1,1,5,6,6,7,5,5,6,,1,1,yeah ,32,1,8,,1,8,1,,6,1,,1,thanks 
1/28/2021 10:09,1/28/2021 10:18,0,100,564,1,1/28/2021 10:18,anonymous,EN-GB,1,Chrome,87.0.4280.141,Windows NT 6.1,1366x768,,,,,,,,,,4,4,4,5,2,,5,4,4,,,,,5,5,5,4,5,3,,,,,,,,,,,14.801,14.801,17.235,1,5.394,5.394,11.901,1,7,4,13.088,13.088,15.68,1,3,7,5,3,2,3,,1,"I do,not believe it has been properly tested and we have yet to see if there are any long term side effects.",2,2,2,,,1,7,99,2,2,2,,,,2,1,3,5,6,3,5,7,5,,2,2,,64,1,4,,2,9,1,,9,1,,1,
1/28/2021 9:14,1/28/2021 10:21,0,100,4013,1,1/28/2021 10:21,anonymous,EN-GB,1,Chrome,88.0.4324.93,Android 9,1280x800,4,5,3,5,1,,1,4,2,,,,,,,,,,6,3,2,5,,,,,5,4,,,,,,,,,,,32.742,91.322,377.516,2,0.798,2.229,3.713,2,6,4,1.142,54.7,55.509,2,5,7,6,1,6,5,,2,I don't Trust the company nor their purposes,3,4,4,,,1,7,99,,,,7,7,3,2,2,5,7,2,2,5,4,5,,1,1,The government forced,24,1,7,,2,8,1,,7,1,,1,No
1/28/2021 10:08,1/28/2021 10:21,0,100,812,1,1/28/2021 10:21,anonymous,EN-GB,1,Chrome,79.0.3945.136,Android 10,412x915,4,4,4,3,4,,5,5,6,,,,,,,,,,1,4,3,4,,,,,5,4,18.975,18.975,24.01,1,2.45,2.45,14.94,1,7,5,,,,,,,,,,,18.987,48.111,55.963,4,4,7,7,3,3,4,,1,There is not enough evidence to suggest that its effective and safe . If after years of trial i might consider ,4,4,4,,,1,7,99,,,,7,7,5,2,2,5,5,4,4,3,5,4,,1,2,,47,2,4,,2,4,1,,2,1,,1,
1/28/2021 10:13,1/28/2021 10:21,0,100,486,1,1/28/2021 10:21,anonymous,EN-GB,1,Chrome,87.0.4280.141,Windows NT 6.1,1600x900,,,,,,,,,,5,5,5,6,5,,5,5,5,,,,,3,6,4,5,5,5,,,,,,,,,,,0,0,20.179,0,0,0,27.169,0,7,4,38.591,38.591,38.964,1,5,5,2,6,5,6,,4,I believe everyone should get the vaccine in order to eradicate Covid 19 for the safety of themselves and others,3,3,3,,,2,7,99,6,4,6,,,,2,2,2,2,4,4,5,4,5,,1,2,,35,1,6,,2,5,1,,5,1,,1,
1/28/2021 10:10,1/28/2021 10:22,0,100,684,1,1/28/2021 10:22,anonymous,EN-GB,1,Chrome,88.0.4324.93,Android 10,360x740,4,4,4,5,6,,4,4,4,,,,,,,,,,4,5,4,4,,,,,4,4,,,,,,,,,,,13.639,28.571,33.314,2,13.114,16.22,17.635,2,6,4,11.281,13.7,18.541,3,6,4,4,5,5,5,,3,Trust the company she did it for saving life ,2,3,3,,,1,7,99,,,,6,6,6,2,2,4,4,4,4,4,4,4,,,2,,50,2,8,,2,2,1,,7,1,,1,No
1/28/2021 10:15,1/28/2021 10:23,0,100,453,1,1/28/2021 10:23,anonymous,EN-GB,1,Chrome,87.0.4280.141,Windows NT 10.0,1536x864,,,,,,,,,,6,6,6,6,3,,4,6,7,,,,,3,7,4,3,1,1,0,0,12.213,0,0,0,10.801,0,7,4,,,,,,,,,,,0,0,8.915,0,6,4,3,7,7,4,,4,"I've already had my first dose and will have my second this weekend. I work in healthcare so there is an increased risk of myself or family members catching it, so i obviously don't want covid, even with the dangers of loosing my sense of smell. ",4,2,4,,,1,7,99,7,4,5,,,,2,2,5,5,1,4,3,1,1,"they incorporate existing prejudices, or algorithms can pick up on prejudices when being trained. Thus, it can incorporate them into government policies and decisions further than they do already. ",1,2,,23,2,8,,1,9,1,,4,1,,1,
1/28/2021 10:14,1/28/2021 10:23,0,100,512,1,1/28/2021 10:23,anonymous,EN-GB,1,Chrome,88.0.4324.104,Windows NT 6.3,1366x768,,,,,,,,,,7,7,7,6,7,,7,7,7,,,,,7,7,3,5,7,6,,,,,,,,,,,0,0,21.714,0,23.215,23.215,24.972,1,7,6,32.864,32.864,35.033,1,7,3,5,7,7,7,,4,i would like to get the vaccine with everyone else and regain normality,4,4,4,,,2,7,99,6,4,7,,,,2,2,2,2,5,7,7,7,7,,2,2,,50,2,7,,2,9,1,,6,1,,1,
1/28/2021 10:11,1/28/2021 10:23,0,100,703,1,1/28/2021 10:23,anonymous,EN-GB,1,Chrome iPad,87.0.4280.77,iPad,768x1024,5,4,3,4,2,,4,3,4,,,,,,,,,,5,4,5,3,,,,,5,3,,,,,,,,,,,15.515,15.515,15.56,1,0,0,117.847,0,6,4,0,0,32.798,0,4,3,4,5,3,5,,4,"To keep my family safe
",3,2,3,,,2,7,99,,,,7,5,4,2,2,4,5,4,3,4,5,4,,2,2,,36,2,7,,2,3,1,,19,1,,1,
1/28/2021 10:13,1/28/2021 10:25,0,100,686,1,1/28/2021 10:25,anonymous,EN-GB,1,Chrome,87.0.4280.141,Android 9,360x780,4,4,4,5,4,,4,4,4,,,,,,,,,,4,4,4,4,,,,,4,4,12.686,24.471,28.329,2,13.744,25.15,30.892,2,3,3,,,,,,,,,,,25.547,48.163,49.449,4,3,3,3,3,3,3,,3,Because it may be the only one available to me and I want to protect myself and others,3,3,3,3,,2,7,99,,,,7,7,4,1,2,3,1,4,3,1,5,4,,,2,,47,2,5,,2,2,1,,20,1,,1,No
1/28/2021 10:17,1/28/2021 10:25,0,100,473,1,1/28/2021 10:25,anonymous,EN-GB,1,Chrome,88.0.4324.104,Windows NT 10.0,1280x720,,,,,,,,,,7,7,7,3,3,,7,7,7,,,,,7,7,2,7,4,7,0,0,2.506,0,0,0,2.365,0,7,7,,,,,,,,,,,0,0,2.357,0,5,5,2,6,5,4,,4,because i dont want to get covid ,4,3,3,,,2,7,99,7,5,5,,,,2,2,6,7,6,6,2,6,4,,,2,,18,1,2,,2,7,1,,5,2,lithuanian,3,
1/28/2021 10:12,1/28/2021 10:25,0,100,800,1,1/28/2021 10:25,anonymous,EN-GB,1,Firefox,84,Windows NT 10.0,1366x768,,,,,,,,,,6,6,6,7,5,,6,6,6,,,,,5,7,4,4,5,4,,,,,,,,,,,50.023,50.023,68.209,1,40.108,40.108,46.237,1,7,3,52.365,52.365,59.89,1,7,1,1,7,7,6,,4,because it will protect me and everyone who takes it  and will help to eradicate the virus ,4,3,3,,,2,7,99,6,5,6,,,,2,2,4,6,4,5,5,3,4,,,2,,43,2,6,,2,6,1,,6,1,,1,
1/28/2021 10:09,1/28/2021 10:26,0,100,979,1,1/28/2021 10:26,anonymous,EN-GB,1,Firefox,84,Windows NT 10.0,1280x720,,,,,,,,,,1,1,1,4,1,,1,4,6,,,,,5,5,1,1,6,4,,,,,,,,,,,0,0,45.343,0,0,0,59.587,0,7,7,0,0,198.883,0,4,7,5,3,2,2,,4,i have old people in my family and i am the one to take care them,3,4,3,,,1,7,99,7,7,2,,,,1,2,3,3,3,5,4,5,5,,1,2,,30,1,5,,2,2,1,,7,2,italian,3,
1/28/2021 10:24,1/28/2021 10:26,0,100,83,1,1/28/2021 10:26,anonymous,EN-GB,1,Chrome,88.0.4324.93,Android 10,412x869,3,4,3,4,5,,3,3,4,,,,,,,,,,4,2,3,4,,,,,2,5,,,,,,,,,,,0.713,0.713,1.566,1,0.548,0.548,1.394,1,2,5,0.657,0.657,1.698,1,2,5,4,3,4,6,,2,Nothing,1,3,1,4,,1,4,,,,,,,,,,,,,,,,,,,,,,,,,,,,,,,,,
1/28/2021 10:14,1/28/2021 10:26,0,100,750,1,1/28/2021 10:26,anonymous,EN-GB,1,Chrome,88.0.4324.93,Android 8.1.0,361x762,7,7,7,7,6,,7,6,7,,,,,,,,,,7,7,2,4,,,,,7,7,,,,,,,,,,,1.779,11.169,12.067,6,3.191,4.661,7.851,3,7,7,1.164,56.595,59.401,10,7,7,6,7,7,7,,4,It is one of most advices vaccines to take ,3,3,3,,,2,7,99,,,,2,2,7,2,2,7,7,7,7,7,7,7,,1,2,,22,2,8,,2,9,1,,7,2,Slovakian,,
1/28/2021 10:23,1/28/2021 10:27,0,100,230,1,1/28/2021 10:27,anonymous,EN-GB,1,Chrome,88.0.4324.104,Windows NT 10.0,1366x768,,,,,,,,,,1,3,2,3,4,,2,3,3,,,,,2,2,3,2,3,4,1.6,1.6,3.383,1,1.08,1.08,2.789,1,3,5,,,,,,,,,,,1.084,1.983,3.98,2,5,5,3,4,4,3,,3,ok,1,3,2,2,,2,4,,,,,,,,,,,,,,,,,,,,,,,,,,,,,,,,,
1/28/2021 10:25,1/28/2021 10:27,0,100,118,1,1/28/2021 10:27,anonymous,EN-GB,1,Chrome,88.0.4324.104,Windows NT 6.1,1366x768,,,,,,,,,,5,5,6,7,2,,1,2,3,,,,,4,5,6,7,7,6,2.171,2.171,3.384,1,1.439,1.439,2.401,1,7,5,,,,,,,,,,,1.393,1.393,2.422,1,6,6,5,6,6,5,,3,kljhblig kbku igoui iugoi oliuhio,3,3,4,3,,3,3,,,,,,,,,,,,,,,,,,,,,,,,,,,,,,,,,
1/28/2021 10:09,1/28/2021 10:29,0,100,1187,1,1/28/2021 10:29,anonymous,EN-GB,1,Chrome,83.0.4103.106,Android 9,360x740,5,5,5,6,5,,4,4,3,,,,,,,,,,2,4,1,4,,,,,4,4,3.041,34.286,35.532,5,6.566,46.383,47.632,14,7,5,,,,,,,,,,,4.145,59.435,62.994,20,4,5,3,4,4,3,,3,"The benefit of the vaccine can be temporally and the side effects not known yet ,also the tulip seems to  have mutations alredy that the vaccine will be ineffective, but once the vaccine will become more safe or improved ,yes is likely to do it.",3,3,3,,,1,7,99,,,,6,4,6,2,2,3,3,4,7,3,6,4,,,2,,33,2,4,,2,5,1,,7,2,Romanian ,3,
1/28/2021 10:20,1/28/2021 10:30,0,100,552,1,1/28/2021 10:30,anonymous,EN-GB,1,Chrome,88.0.4324.93,Android 10,412x869,3,3,2,6,1,,2,2,3,,,,,,,,,,5,3,1,4,,,,,5,5,0,0,15.627,0,8.795,8.795,15.894,1,7,5,,,,,,,,,,,20.963,32.384,35.5,4,4,5,5,4,3,2,,1,I do not trust anything driven to market by fear and bullying.,3,2,2,,,1,7,99,,,,2,2,1,2,1,2,3,3,1,3,2,4,,1,2,,40,2,4,,2,3,1,,23,1,,1,"Very interesting information, thank you"
1/28/2021 10:17,1/28/2021 10:35,0,100,1108,1,1/28/2021 10:35,anonymous,EN-GB,1,Chrome,88.0.4324.104,Windows NT 10.0,1366x768,,,,,,,,,,6,6,6,7,5,,7,7,7,,,,,5,7,1,3,6,6,,,,,,,,,,,30.405,31.372,33.701,6,28.12,29.202,31.787,8,7,7,59.17,60.4,69.413,8,7,3,4,7,7,7,,4,to protect me from covid 19,4,2,4,,,2,7,99,7,7,7,,,,2,2,7,6,4,4,7,5,5,,1,1,step by step solution,47,2,3,,2,3,1,,7,1,,1,
1/28/2021 10:14,1/28/2021 10:36,0,100,1297,1,1/28/2021 10:36,anonymous,EN-GB,1,Chrome,88.0.4324.93,Android 9,360x780,4,4,4,4,3,,4,5,5,,,,,,,,,,2,5,2,4,,,,,3,3,19.806,19.806,23.522,1,18.652,24.018,29.852,2,7,4,,,,,,,,,,,25.341,47.095,54.734,4,6,5,5,4,5,5,,2,Worried about long term side effects,2,1,2,2,,1,7,99,,,,5,5,4,1,2,1,1,5,2,3,5,4,,1,2,,51,1,7,,2,9,1,,13,2,French,3,N/a
1/28/2021 10:35,1/28/2021 10:44,0,100,538,1,1/28/2021 10:44,anonymous,EN-GB,1,Chrome,88.0.4324.93,Android 10,444x985,6,6,6,7,4,,7,7,6,,,,,,,,,,4,7,1,4,,,,,4,1,7.69,13.993,14.881,2,7.84,7.84,12.787,1,7,3,,,,,,,,,,,7.856,7.856,10.58,1,5,4,3,5,4,4,,4,I want the vaccine so I can continue my life safely,4,3,4,,,1,7,99,,,,7,4,7,1,2,5,5,4,4,4,5,1,History proved it,1,1,News item,57,1,5,,2,8,1,,26,2,Gaelic,1,
1/28/2021 10:39,1/28/2021 10:47,0,100,487,1,1/28/2021 10:47,anonymous,EN-GB,1,Safari iPhone,14.0.2,iPhone,414x896,1,1,1,6,1,,4,4,4,,,,,,,,,,1,3,1,4,,,,,4,5,,,,,,,,,,,9.49,9.772,15.404,2,1.1,1.1,2.717,1,4,4,22.679,24.904,24.93,2,5,3,3,5,3,1,,1,"I don’t trust WHO. I don’t think so covid is so much dangerous like media, government etc show. It’s all about the many and there is a second bottom... for sure nothing good for us. ",1,1,1,,,1,7,99,,,,3,2,1,1,2,4,4,4,4,3,5,3,A,,2,,44,2,4,,2,5,1,,9,2,Polish ,3,No 
1/28/2021 10:36,1/28/2021 10:49,0,100,738,1,1/28/2021 10:49,anonymous,EN-GB,1,Chrome,88.0.4324.93,Android 10,768x346,6,6,6,5,4,,7,7,7,,,,,,,,,,5,7,4,4,,,,,4,4,,,,,,,,,,,2.329,16.965,20.037,7,2.49,57.72,58.95,10,7,5,5.146,28.534,30.772,11,7,5,2,6,7,7,,4,I believe in advantages of having a vaccine,4,4,4,,,2,7,99,,,,7,2,7,2,2,3,3,4,4,4,4,1,Numbers are factual only,1,2,,50,1,3,,2,9,1,,6,1,,1,No
1/28/2021 10:36,1/28/2021 10:52,0,100,937,1,1/28/2021 10:52,anonymous,EN-GB,1,Chrome,88.0.4324.93,Android 5.1.1,320x534,6,6,5,7,5,,5,6,6,,,,,,,,,,2,5,2,1,,,,,2,2,0.873,34.727,36.395,17,0.955,21.008,21.601,24,7,5,,,,,,,,,,,3.136,21.392,22.152,22,6,4,2,6,6,5,,4,not going to let covid19 make my life a treat,4,4,4,,,2,7,99,,,,7,7,6,2,2,5,4,5,4,4,5,4,,1,1,word play,61,1,2,,2,4,1,,,1,,1,no
1/28/2021 7:27,1/28/2021 10:56,0,100,12517,1,1/28/2021 10:56,anonymous,EN-GB,1,Chrome,88.0.4324.104,Windows NT 10.0,2048x1152,,,,,,,,,,1,1,1,3,3,,2,3,4,,,,,5,5,4,7,4,4,,,,,,,,,,,0,0,8.995,0,173.012,173.012,184.679,1,7,5,141.08,141.08,219.847,1,5,5,5,4,4,5,,1,No long term trials,3,3,3,,,1,7,39,2,3,3,,,,1,2,2,2,6,1,6,4,4,,2,1,cant think of one,20,1,4,,2,9,1,,5,1,,1,
1/28/2021 10:45,1/28/2021 11:02,0,100,979,1,1/28/2021 11:02,anonymous,EN-GB,1,Chrome,88.0.4324.93,Android 10,393x851,5,5,4,5,1,,5,6,6,,,,,,,,,,4,6,4,3,,,,,4,3,,,,,,,,,,,6.941,6.941,10.71,1,2.416,2.416,5.949,1,7,5,3.798,6.354,13.677,2,6,2,3,6,5,6,,3,"We all need the vaccine, we have to learn to live with this, as so we can done kind of normality back in our lives, getting the vacine wil help",4,2,3,1,Na,1,7,99,,,,7,3,3,1,2,4,6,1,4,5,5,3,Not a believer in algorithms,1,2,,55,1,2,,2,9,1,,19,1,,1,
1/28/2021 10:50,1/28/2021 11:06,0,100,982,1,1/28/2021 11:06,anonymous,EN-GB,1,Chrome,88.0.4324.104,Windows NT 10.0,1600x900,,,,,,,,,,6,6,6,6,5,,6,6,5,,,,,5,7,2,1,3,3,0,0,25.82,0,0,0,30.757,0,7,2,,,,,,,,,,,0,0,40.908,0,7,2,1,7,7,7,,4,I basicaly trust the Scientists in the EU and I know the approval of the vaccine was faster than normal but we are in a terrible situation in the world due to Covid 19 and the testing procedures had to be speeded up for the world good.There were no major side effects in the trials so I will gladly take the vaccine when it becomes available.,4,3,4,,,1,7,99,4,5,6,,,,1,2,6,6,3,7,6,1,3,They dont take account of average human behaviour..They forget the individual.,1,2,,62,1,3,,2,2,1,,27,1,,1,"No,thank you,Enjoyed this survey."
1/28/2021 11:07,1/28/2021 11:09,0,100,131,1,1/28/2021 11:09,anonymous,EN-GB,1,Safari iPhone,14.0.2,iPhone,414x896,4,5,3,4,4,,3,4,4,,,,,,,,,,4,4,4,4,,,,,5,5,0.469,0.746,1.531,2,0.5,0.76,1.961,2,3,3,,,,,,,,,,,0.388,0.688,1.375,2,7,1,1,7,4,6,,2,Don’t trust ,2,3,3,,?,3,4,,,,,,,,,,,,,,,,,,,,,,,,,,,,,,,,,
1/28/2021 11:06,1/28/2021 11:10,0,100,273,1,1/28/2021 11:10,anonymous,EN-GB,1,Chrome,88.0.4324.93,Android 10,360x760,5,4,3,5,5,,5,5,5,,,,,,,,,,6,6,6,5,,,,,6,5,0.563,0.563,1.713,1,0.557,0.557,1.43,1,6,4,,,,,,,,,,,0.551,0.551,1.434,1,5,6,5,6,6,7,,2,Hhhb,3,2,2,3,Hhh,2,7,99,,,,4,5,6,1,1,5,5,6,6,5,5,6,,2,1,Nnnnn,73,1,3,,2,8,1,,21,2,Polish,2,
1/28/2021 11:08,1/28/2021 11:13,0,100,262,1,1/28/2021 11:13,anonymous,EN-GB,1,Safari iPhone,14.0.2,iPhone,375x667,1,1,4,7,1,,1,1,4,,,,,,,,,,4,7,2,6,,,,,5,4,,,,,,,,,,,1.551,1.551,3.08,1,0.743,1.193,2.225,2,6,3,0.845,3.595,5.157,3,5,5,5,4,4,3,,4,I am sick of this shit,3,4,2,3,,1,7,99,,,,5,5,3,2,2,3,4,4,4,4,5,5,,3,2,,33,1,7,,2,9,1,,27,1,,1,
1/28/2021 11:06,1/28/2021 11:13,0,100,405,1,1/28/2021 11:13,anonymous,EN-GB,1,Chrome,87.0.4280.141,Android 10,360x760,5,5,5,5,4,,6,6,6,,,,,,,,,,4,1,1,1,,,,,5,1,9.316,16.794,21.333,2,3.218,3.868,5.485,2,7,3,,,,,,,,,,,2.56,7.676,8.264,5,5,5,2,5,5,6,,4,It is important to take all necessary steps to eradicate Covid 19,4,2,3,,,1,7,99,,,,5,1,6,2,2,5,5,5,4,5,4,6,,1,1,Insurance companies use for premium setting,59,1,4,,2,9,1,,8,1,,1,
1/28/2021 11:08,1/28/2021 11:15,0,100,401,1,1/28/2021 11:15,anonymous,EN-GB,1,Chrome,88.0.4324.93,Android 10,320x676,4,4,4,4,1,,4,4,4,,,,,,,,,,4,4,4,4,,,,,4,3,3.856,5.69,6.502,2,2.126,2.126,3.909,1,6,5,,,,,,,,,,,28.649,33.697,35.779,3,4,6,5,3,3,3,,1,This time last year there wasnt a vaccine and now it's been made and approved and given to people.its to fast,3,3,3,,,2,7,99,,,,5,4,5,1,2,1,1,1,4,1,4,4,,2,2,,37,2,2,,2,2,1,,31,1,,1,
1/28/2021 11:09,1/28/2021 11:15,0,100,395,1,1/28/2021 11:15,anonymous,EN-GB,1,Safari,14.0.2,Macintosh,1920x1080,,,,,,,,,,4,4,4,5,3,,5,4,4,,,,,5,6,3,4,4,4,,,,,,,,,,,0,0,25.499,0,0,0,43.836,0,6,7,0,0,1.829,0,5,4,4,5,4,4,,4,I would prefer to get back to normality sooner rather than later. ,3,3,4,3,,2,7,99,5,7,7,,,,2,2,4,5,3,5,3,4,5,,1,2,,28,1,8,,2,3,1,,4,1,,1,No.
1/28/2021 11:06,1/28/2021 11:16,0,100,616,1,1/28/2021 11:16,anonymous,EN-GB,1,Chrome,88.0.4324.93,Android 8.1.0,360x780,7,5,4,7,3,,3,6,5,,,,,,,,,,5,7,3,4,,,,,4,3,,,,,,,,,,,2.68,17.526,29.05,4,2.749,7.696,8.287,3,7,1,1.812,43.867,45.298,8,6,2,2,7,7,7,,4,I believe vaccination programs are extremely important to health &well being. I take flu vac each year &whooping cough while pregnant,4,3,4,,,1,7,,,,,7,3,5,2,2,4,5,5,3,5,7,3,No room for special circumstances,1,1,No,31,2,6,,2,9,1,,17,1,,1,No
1/28/2021 11:08,1/28/2021 11:16,0,100,473,1,1/28/2021 11:16,anonymous,EN-GB,1,Chrome,88.0.4324.93,Android 9,360x640,5,6,4,7,4,,5,6,5,,,,,,,,,,5,7,4,4,,,,,5,5,,,,,,,,,,,2.767,8.04,17.755,2,5.095,21.843,22.785,6,7,5,4.483,6.573,7.99,2,6,6,6,7,7,6,,4,I have MS so I'm in the high risk catagory. Hopefully the vaccine will bring back our old lives,4,4,4,3,,2,7,99,,,,7,7,6,2,2,3,5,3,4,3,3,5,,2,2,,37,1,5,,2,2,1,,22,1,,1,Best of luck with the survey
1/28/2021 11:06,1/28/2021 11:16,0,100,641,1,1/28/2021 11:16,anonymous,EN-GB,1,Chrome,84.0.4147.89,Android 10,320x694,1,1,1,4,1,,1,1,1,,,,,,,,,,3,4,1,1,,,,,2,1,,,,,,,,,,,1.1,12.116,16.063,10,1.78,10.764,12.654,11,7,6,5.423,15.125,17.992,13,1,6,5,4,3,7,,1,Not enough research into it and it does not stop u from getting the virus ,2,2,2,2,,1,7,99,,,,1,4,1,2,2,6,4,1,5,1,5,3,They don't look at all the aspects of the question ,1,1,On Facebook ,54,1,2,,2,2,1,,12,1,,1,Good survey 
1/28/2021 11:15,1/28/2021 11:18,0,100,168,1,1/28/2021 11:18,anonymous,EN-GB,1,Safari iPad,9,iPad,768x1024,4,5,4,4,5,,4,5,4,,,,,,,,,,3,4,5,5,,,,,3,5,0,0,2.568,0,0,0,1.27,0,5,2,,,,,,,,,,,0,0,3.701,0,5,5,2,4,5,2,,2,Good,3,3,3,,,2,2,,,,,,,,,,,,,,,,,,,,,,,,,,,,,,,,,
1/28/2021 11:10,1/28/2021 11:19,0,100,552,1,1/28/2021 11:19,anonymous,EN-GB,1,Chrome iPad,87.0.4280.77,iPad,834x1112,3,3,3,7,1,,3,3,5,,,,,,,,,,5,6,5,5,,,,,4,4,1.664,17.649,30.221,2,2.328,19.13,35.539,4,6,5,,,,,,,,,,,1.244,50.607,53.726,3,4,5,5,6,5,6,,4,To get back to normal life,3,3,3,,,1,7,99,,,,7,5,3,2,1,1,1,4,4,3,5,4,,1,2,,33,2,4,,2,9,1,,28,1,,1,
1/28/2021 11:09,1/28/2021 11:19,0,100,611,1,1/28/2021 11:19,anonymous,EN-GB,1,Chrome,79.0.3945.136,Android 7.0,1280x800,6,6,6,6,5,,6,6,6,,,,,,,,,,4,5,3,4,,,,,4,4,,,,,,,,,,,9.52,9.52,21.012,1,13.713,13.713,28.5,1,7,5,1.159,41.252,44.973,3,6,3,2,6,7,6,,2,Worried about side effects may wait for the Oxford one,4,3,4,,,2,7,99,,,,7,4,5,2,2,5,5,4,3,5,4,4,,2,1,Predicting numbers that would be infected by covid 19 in my country,62,2,3,,2,5,1,,9,1,,1,No
1/28/2021 11:09,1/28/2021 11:21,0,100,673,1,1/28/2021 11:21,anonymous,EN-GB,1,Firefox,85,Windows NT 10.0,1366x768,,,,,,,,,,6,3,5,6,6,,5,3,6,,,,,1,6,3,5,6,5,,,,,,,,,,,2.907,2.907,18.266,1,25.884,27.466,32.96,2,6,7,2.437,15.583,18.286,3,1,7,7,2,3,6,,1,"I think that the story about Pfizer is very political, we struggle already for a while to get the promised dose, people are dying while Pfizer is reseling for a high price to the Israel, USA, and UK. this is not ethical, human, is shameful.
I'm absolutely disgusted by it. even if there is a chance to get a vaccine from Pfizer, I would refuse for that reason, I prefer tan Russian or Chines vaccine.",1,1,1,,,1,5,,,,,,,,,,,,,,,,,,,,,,,,,,,,,,,,,
1/28/2021 11:16,1/28/2021 11:21,0,100,309,1,1/28/2021 11:21,anonymous,EN-GB,1,Chrome,88.0.4324.93,Android 10,412x846,5,5,5,5,4,,5,4,4,,,,,,,,,,4,5,7,1,,,,,4,4,,,,,,,,,,,1.764,1.764,2.401,1,1.457,1.457,2.201,1,5,5,1.571,1.571,2.413,1,4,5,5,5,4,4,,1,No evidence ,3,3,3,,,3,7,99,,,,7,7,4,1,2,4,4,4,4,4,7,7,,1,1,N0,40,1,4,,2,3,1,,28,1,,1,No
1/28/2021 10:42,1/28/2021 11:23,0,100,2432,1,1/28/2021 11:23,anonymous,EN-GB,1,Chrome,88.0.4324.93,Android 9,360x780,1,1,1,5,3,,3,3,1,,,,,,,,,,3,2,1,4,,,,,2,2,,,,,,,,,,,16.457,26.144,30.186,3,13.483,45.982,52.101,6,7,7,2.1,96.853,115.085,8,4,4,4,6,4,4,,2,Concerned about the health risks and long-term outcomes after the vaccine is taken,1,1,1,,,2,7,99,,,,2,5,3,1,2,2,2,5,3,2,3,1,Because I don't trust algorithms alone to come up with a fair representation ,1,2,,28,1,2,,2,2,1,,7,1,,1,
1/28/2021 11:18,1/28/2021 11:26,0,100,457,1,1/28/2021 11:26,anonymous,EN-GB,1,Chrome,87.0.4280.88,Macintosh,1440x900,,,,,,,,,,7,7,7,5,4,,7,7,7,,,,,6,7,3,5,5,5,,,,,,,,,,,0,0,15.456,0,0,0,25.758,0,7,3,0,0,24.592,0,6,1,1,6,5,7,,4,I believe that the vaccine works and I would like to return to normal life as soon as possible. The side effects seem minor in comparison the disease.,4,4,4,,,2,7,99,7,6,6,,,,1,2,5,6,4,7,1,7,3,It may not take into the specific needs of each person ,1,2,,21,2,4,,2,3,1,,7,1,,3,
1/28/2021 11:11,1/28/2021 11:27,0,100,997,1,1/28/2021 11:27,anonymous,EN-GB,1,Chrome,88.0.4324.93,Android 8.0.0,360x720,3,3,3,6,2,,5,5,4,,,,,,,,,,2,6,2,3,,,,,3,3,11.191,23.712,28.782,4,10.605,33.435,38.453,9,7,3,,,,,,,,,,,14.28,58.011,58.86,8,6,3,3,6,5,5,,4,I will take on the basis that it has to be done. It's the only way we can get back to a normal life again. But every country must be allowed access to a vaccine because if poorer countries can't afford it or can't get it then the virus will always be with us ,3,3,3,,,1,7,99,,,,5,4,6,2,2,3,4,2,2,1,3,4,,1,2,,64,1,5,,2,2,1,,11,1,,1,Survey was interesting 
1/28/2021 11:23,1/28/2021 11:30,0,100,417,1,1/28/2021 11:30,anonymous,EN-GB,1,Safari iPhone,14.0.2,iPhone,375x667,7,7,7,7,5,,7,7,7,,,,,,,,,,6,7,3,3,,,,,7,6,,,,,,,,,,,1.177,8.382,18.033,3,1.239,19.754,23.832,4,7,2,4.537,10.64,16.141,2,7,1,1,7,7,7,,4,I am keen to get the vaccine and trust ot,4,1,4,,,2,7,99,,,,7,1,6,2,2,7,7,2,5,6,4,6,,2,2,,40,2,6,,2,2,1,,12,1,,1,
1/28/2021 11:22,1/28/2021 11:31,0,100,503,1,1/28/2021 11:31,anonymous,EN-GB,1,Edge,88.0.705.50,Windows NT 10.0,1280x720,,,,,,,,,,6,6,6,6,4,,5,6,6,,,,,6,7,4,5,6,6,1.806,1.806,20.441,1,1.795,26.017,28.468,3,7,4,,,,,,,,,,,3.256,40.721,41.71,5,6,4,4,6,6,6,,3,We need as many people as possible to take the vaccine if we want life to return to normal and I believe getting the vaccine will protect me from getting Covid-19,3,2,4,,,1,7,99,5,5,4,,,,2,2,2,2,5,5,4,4,5,,1,2,,22,2,6,,2,2,1,,7,1,,1,
1/28/2021 11:08,1/28/2021 11:31,0,100,1406,1,1/28/2021 11:31,anonymous,EN-GB,1,Chrome,87.0.4280.88,Windows NT 6.1,1536x864,,,,,,,,,,1,1,1,2,1,,1,1,2,,,,,3,2,2,3,2,2,14.449,14.449,24.466,1,2.577,2.577,42.977,1,7,7,,,,,,,,,,,4.162,4.162,34.835,1,1,7,7,1,1,2,,1,"who sane would take EXPERIMENTAL, dna altering poison with skiiped animal trials and that will not protect against infection and spread ingto others? AND it is NOT a vaccine - is a medical device, an operating system as per pfizer and moderna. AND hearing and reading about SO MANY deaths and severe side effects after injection ONLY suicides would take it - AND we do not know about long term side effects yetr",1,1,1,,,1,7,99,1,7,1,,,,2,2,6,7,4,1,3,6,1,because it is AI based - and AI can be programmed and given data that will produce whatever result you want,1,1,"heard about few, can;t recall details just right now",50,1,8,,2,5,1,,9,2,Polish,3,"seasonal flu with 99,9 survival rate, not pandemic! Great Reset, Agenda 2030, etc - it is NOT about our health - just the opposite. Crimes Against Humanity"
1/28/2021 11:12,1/28/2021 11:35,0,100,1369,1,1/28/2021 11:35,anonymous,EN-GB,1,Chrome,87.0.4280.88,Windows NT 6.1,1366x768,,,,,,,,,,6,6,6,7,5,,7,7,7,,,,,7,7,2,5,6,6,3.021,4.401,19.259,3,3.784,6.275,8.208,7,7,6,,,,,,,,,,,3.986,3.986,9.923,1,7,7,5,7,6,7,,4,because i believe it is the first major step on getting back to normality and making one safe,4,3,4,,,2,7,99,7,1,6,,,,1,1,5,6,3,7,5,7,7,,1,1,in assessing insurance liabilities,65,1,3,,1,9,1,,7,1,,1,no thanks
1/28/2021 11:19,1/28/2021 11:35,0,100,968,1,1/28/2021 11:35,anonymous,EN-GB,1,Edge,88.0.705.53,Windows NT 10.0,1366x768,,,,,,,,,,4,4,4,6,4,,5,6,5,,,,,5,7,2,4,5,4,1.981,3.371,5.193,2,127.789,127.789,139.225,1,6,6,,,,,,,,,,,10.149,10.149,11.899,1,6,4,4,6,6,6,,1,allergies should not take as per there recommendations,4,4,4,,,2,7,99,6,6,6,,,,2,2,5,6,4,4,5,2,4,,2,2,,72,2,3,,2,2,1,,20,1,,2,
1/28/2021 11:15,1/28/2021 11:37,0,100,1339,1,1/28/2021 11:37,anonymous,EN-GB,1,Chrome,80.0.3987.119,Android 9.0,1152x864,7,6,7,6,6,,7,7,7,,,,,,,,,,7,6,6,7,,,,,6,7,,,,,,,,,,,0,0,2.085,0,0,0,10.982,0,7,6,0,0,1.994,0,7,6,6,7,6,7,,4,fhryht,3,4,4,,,1,6,,,,,,,,,,,,,,,,,,,,,,,,,,,,,,,,,
1/28/2021 11:35,1/28/2021 11:48,0,100,781,1,1/28/2021 11:48,anonymous,EN-GB,1,Chrome,83.0.4103.106,Android 10,412x869,4,4,4,5,4,,4,4,4,,,,,,,,,,4,2,2,4,,,,,4,4,9.755,9.755,19.033,1,83.658,90.336,92.301,3,6,4,,,,,,,,,,,44.555,46.081,69.411,2,2,6,4,2,2,2,,1,Had not enough time spend on vaccine 'a explore. ,2,1,2,,,2,7,99,,,,7,7,4,2,2,5,5,4,4,6,4,4,,,2,,52,2,5,,2,4,1,,30,2,Latvian,3,
1/28/2021 11:47,1/28/2021 11:53,0,100,393,1,1/28/2021 11:53,anonymous,EN-GB,1,Chrome,87.0.4280.141,Windows NT 10.0,1366x768,,,,,,,,,,5,5,5,7,4,,4,5,5,,,,,6,7,2,4,5,4,,,,,,,,,,,0,0,40.802,0,0,0,15.549,0,5,4,0,0,23.73,0,7,5,3,7,7,7,,4,The reward outweighs the risk,3,2,3,,,2,7,99,7,6,5,,,,2,2,3,3,1,4,7,1,5,,,2,,18,2,2,,2,8,1,,9,1,,1,
1/28/2021 11:40,1/28/2021 11:55,0,100,883,1,1/28/2021 11:55,anonymous,EN-GB,1,Edge,88.0.705.53,Windows NT 10.0,1440x900,,,,,,,,,,5,5,5,5,5,,6,5,6,,,,,5,6,3,3,5,4,,,,,,,,,,,0,0,31.133,0,0,0,41.934,0,5,3,0,0,51.151,0,6,3,3,6,6,6,,4,It is safer to get the vaccine than to get covid19,4,3,4,3,,2,7,99,6,4,5,,,,2,2,4,6,5,5,5,3,4,,1,2,,69,1,3,,2,8,1,,12,1,,1,No comments
